{
  "$schema": "https://json-schema.org/draft/2020-12/schema",
  "$id": "event.v1",
  "title": "EventV1",
  "description": "Discrete machine event on cat/{site}/{machine}/event (HLD §6.9, §6.15).",
  "type": "object",
  "additionalProperties": false,
  "required": [
    "schema",
    "event_id",
    "ts",
    "machine_id",
    "type",
    "severity",
    "seq",
    "source",
    "payload"
  ],
  "properties": {
    "schema": {
      "const": "event.v1"
    },
    "event_id": {
      "type": "string",
      "format": "uuid"
    },
    "ts": {
      "type": "string",
      "format": "date-time",
      "pattern": "^\\d{4}-\\d{2}-\\d{2}T\\d{2}:\\d{2}:\\d{2}(\\.\\d+)?(Z|[+-]\\d{2}:\\d{2})$"
    },
    "machine_id": {
      "type": "string"
    },
    "operator_id": {
      "type": [
        "string",
        "null"
      ]
    },
    "shift_id": {
      "type": [
        "string",
        "null"
      ]
    },
    "type": {
      "enum": [
        "IGNITION_ON",
        "IGNITION_OFF",
        "SEATBELT_FASTENED",
        "SEATBELT_UNFASTENED",
        "SEAT_OCCUPIED",
        "SEAT_VACATED",
        "DOOR_OPEN",
        "DOOR_CLOSED",
        "HYD_LOCK",
        "HYD_UNLOCK",
        "PARK_BRAKE_ON",
        "PARK_BRAKE_OFF",
        "IDLE_START",
        "IDLE_END",
        "EXIT_ATTEMPT",
        "EXIT_COMPLETED",
        "MOUNT",
        "COUPLER_UNLOCK",
        "COUPLER_LOCK",
        "COUPLER_TEST_PASSED",
        "TILT_EXCEEDED",
        "PROXIMITY_ENTER",
        "PROXIMITY_EXIT",
        "GEOFENCE_ENTER",
        "GEOFENCE_EXIT",
        "DTC_ACTIVE",
        "DTC_CLEARED",
        "DATA_STALE",
        "DATA_RESTORED"
      ]
    },
    "severity": {
      "enum": [
        "INFO",
        "CAUTION",
        "WARNING",
        "CRITICAL"
      ]
    },
    "rule_id": {
      "type": [
        "string",
        "null"
      ],
      "pattern": "^R\\d{2}$"
    },
    "seq": {
      "type": "integer",
      "minimum": 0,
      "description": "Monotonic per machine."
    },
    "source": {
      "enum": [
        "ingest",
        "risk-engine",
        "cv",
        "operator"
      ]
    },
    "payload": {
      "type": "object"
    }
  }
}
